Name,Link,Categories,Pricing,Platforms,Tags,Description
Game Dev Network,https://discord.com/invite/gdn,Communication,,,Discord,"We're a friendly GameDev community that welcomes all skill levels - Unity / Unreal / C++ / C# 💖Meet, Learn, Share 💖 | 22,991 members"
Game Dev League,https://discord.com/invite/gamedev,Communication,,,Discord,"GameDevLeague is a community built for Game Developers by Game Developers. Make, learn and grow with like minded people. | 38,281 members"
Unreal Slackers,https://discord.com/invite/unreal-slackers,Communication,,,Discord,"Check out the Unreal Slackers community on Discord - hang out with 47,186 other members and enjoy free voice and text chat."
Unity Official Discord,https://discord.com/invite/unity,Communication,,,Discord,"The Official Unity Technologies Discord Server. Unity is the world’s leading real-time 3D development platform. | 43,228 members"
Unity Developer Community,https://discord.com/invite/vsN2eYZf,Communication,,,Discord,
r/Game Dev Discord,https://discord.com/invite/vupRVHT,Communication,,,Discord,"Check out the Reddit /r/gamedev community on Discord - hang out with 11,795 other members and enjoy free voice and text chat."
r/Game Dev,https://www.reddit.com/r/gamedev/,Social Media,,,Reddit,"r/gamedev: All things related to game development, programming, math, art, music, business, and marketing."
r/Game Dev Classified,https://www.reddit.com/r/gameDevClassifieds/,Social Media,,,Reddit,r/gameDevClassifieds: Post your services / available jobs as they relate to the game industry. Keep your topic(s) SFW so that recruiters and those …
r/INAT,https://www.reddit.com/r/INAT,"Social Media, Team Building",,,Reddit,"r/INAT: A subreddit created to bring together like-minded creatives for the purpose of collaboration, networking, and gaining experience in …"
r/Game Design,https://www.reddit.com/r/gamedesign/,Social Media,,,Reddit,"r/gamedesign: For topics related to the design of games for interactive entertainment systems - video games, board games, tabletop RPGs, or any …"
r/Dev Blogs,https://www.reddit.com/r/devblogs/,Social Media,,,Reddit,"r/devblogs: /r/DevBlogs is a place to come, everyday, and see what other redditors and industry pros are working on. Come add your blog!"
r/Indie Dev,https://www.reddit.com/r/IndieDev/,Social Media,,,Reddit,"r/IndieDev: This is the place for indie devs and gamers to share anything, be it game development, their favorite games or just cool images, GIFs …"
r/Indie Gaming,https://www.reddit.com/r/IndieGaming/,Social Media,,,Reddit,"r/IndieGaming: We love indie games, you should too!"
r/Unity3D,https://www.reddit.com/r/Unity3D/,Social Media,,,Reddit,"r/Unity3D: News, Help, Resources, and Conversation. A User Showcase of the Unity Game Engine."
r/Unity2D,https://www.reddit.com/r/Unity2D/,Social Media,,,Reddit,r/Unity2D: A subreddit for the 2D aspects of Unity3D game development.
r/Unreal Engine,https://www.reddit.com/r/unrealengine/,Social Media,,,Reddit,"r/unrealengine: The official subreddit for the Unreal Engine by Epic Games, inc. A community with content by developers, for developers!"
r/Game Maker,https://www.reddit.com/r/gamemaker/,Social Media,,,Reddit,"r/gamemaker: This subreddit is dedicated to providing programmer support for the game development platform, GameMaker Studio. GameMaker Studio is …"
r/Godot,https://www.reddit.com/r/godot/,Social Media,,,Reddit,r/godot: A community for discussion and support in development with the Godot game engine.
r/Play My Game,https://www.reddit.com/r/playmygame/,Social Media,,,Reddit,r/playmygame: A place for indie developers to share their games!
Reddit,https://www.reddit.com/,Social Media,,,Reddit,"Reddit is a network of communities based on people's interests. Find communities you're interested in, and become part of an online community!"
Twitter,https://twitter.com/,Social Media,,,Twitter,#gamedev #indiedev #indiegames #screenshotsaturday
IndieDevHour,https://twitter.com/hashtag/indiedevhour,Social Media,,,Twitter,Twitter event to showcase your game. Starts Wednesday at 7pm UK Time
ScreenshotSaturday,https://twitter.com/hashtag/screenshotsaturday,Social Media,,,Twitter,Twitter event to showcase your game
Indie Game Devolpers,https://www.facebook.com/groups/IndieGameDevs/,Social Media,,,"Facebook ",This group is for sharing free resources and information and asking game development questions. Video Game Group
Imgur,https://imgur.com/,Social Media,,,,"Discover the magic of the internet at Imgur, a community powered entertainment destination. Lift your spirits with funny jokes, trending memes, entertaining gifs, inspiring stories, viral videos, and so much more. Useful for sharing devlogs and marketing your indie game"
Gamedev.net,https://www.gamedev.net/,Community,,,,"GameDev.net is your resource for game development with forums, tutorials, blogs, projects, portfolios, news, and more."
Itchio,https://itch.io/,"Game Hosting, Community, Team Building",,,,"itch.io is a simple way to find, download and distribute indie games online. Whether you're a developer looking to upload your game or just someone looking for something new to play itch.io has you covered."
IndieDB,https://www.indiedb.com/,"Game Hosting, Community, Team Building",,,,"Indie DB the independent games site. News, downloads and media direct from the developers. Powered by ramen noodles."
Devel Team,https://www.develteam.com/,"Community, Team Building",,,,"A Community for Creating Games. Share your game developer portfolio, collaboration forums, chat rooms, game dev team up, indie team up. Start Making Games!"
NeoGAF,https://www.neogaf.com/,Forum,,,,It's a video game message board on the internet
TIGSource,https://forums.tigsource.com/index.php,Forum,,,,
Make Games SA,http://makegamessa.com/,Forum,,,,
Game Development Stack Exchange,https://gamedev.stackexchange.com/,FAQ,,,,Q&A for professional and independent game developers
Gamesmith,https://www.gamesmith.com/,Professional Network,,,," "
GDBay Network,https://gdbay.com/network/,Professional Network,Subscritption,,B2B,"Explore game companies, hire game developers, find jobs in gaming & game 
developer conferences. GDBAY is a complete game dev industry portal."
Deviant Art,https://www.deviantart.com/,Art,,,,"DeviantArt is the world's largest online social community for artists and 
art enthusiasts, allowing people to connect through the creation and sharing of art."
Art Station,https://www.artstation.com/,Art,,,,"ArtStation is the leading showcase platform for games, film, media & 
entertainment artists."
Pinterest,https://www.pinterest.com/,Art,,,,"Discover recipes, home ideas, style inspiration and other ideas to try. Share art work and also build reference boards for art you want to make"
The Rookies,https://www.therookies.co/,Art,,,,"Find out everything you need to know about The Rookies from rules, important dates, sponsors, prizes, internships, judging panel, and the team."
Polycount,https://polycount.com/,Art,,,,
Newgrounds,https://www.newgrounds.com/games,"Art, Games",,,,
CG Society,https://cgsociety.org/,Art,,,,"The CGSociety supports artists at every level by offering a range of 
services to connect, inform, educate and promote digital artists worldwide."
3dtotal,https://3dtotal.com/,Art,,,,"Discover the latest in the world of digital art – learn from fellow 
artists, create your own masterpieces, and share them with the art community."
p3d,https://p3d.in/,Art,,,,
Google Poly,https://poly.google.com/,Art,,,,"Browse, discover, and download 3D objects and scenes. Poly lets you quickly 
find 3D objects and scenes for use in your apps, and it was built from the 
ground up with AR and VR development in mind."
Shadertoy,https://www.shadertoy.com/,Art,,,Shader,Platform to build and share shader art
Fandom Wikia,https://www.fandom.com/,Wiki,Free,Web,,"The entertainment site where fans come first. Your daily source for all things TV, movies, and games, including Star Wars, Fallout, Marvel, DC and more."
Gamepedia,https://www.gamepedia.com/,Wiki,Free,Web,,
Fextralife Wikis,https://www.wiki.fextralife.com/,Wiki,Free,Web,,
Meetup Groups,https://www.meetup.com/,Local Networking,,,,Find Meetup events so you can do more of what matters to you. Or create your own group and meet people near you who share your interests.
Eventbrite,https://www.eventbrite.com/,Local Networking,,,,"Eventbrite brings people together through live experiences. Discover events that match your passions, or create your own with online ticketing tools."
IGDA,https://www.igda.org/,Organization,,,,
ESA,https://www.theesa.com/,Organization,,,,We are the video game industry. We are visionaries redefining the business and creative boundaries of entertainment.
UKIE,https://ukie.org.uk/,Organization,,,UK,
Women in Games,http://www.womeningames.org/,Organization,,,,"Not for profit organisation for women in video, mobile, online games & esports. Join our professional network today."
Games for Change,http://www.gamesforchange.org/,Organization,,,,
SGA,http://sga.rs/en/,Organization,,,Serbia,"Serbian Games Association (SGA) is a non-profit, NGO, focused on developing the national gaming industry."
The Great Journey,https://thegreatjourney.se/,Organization,,,Sweden,
European Games Developer Federation,http://www.egdf.eu/,Organization,,,Europe,
Immerse UK,https://www.immerseuk.org/,Organization,,,UK,"ImmerseUK is a cross-sector network for businesses, research and educational organisations across the UK that are interested in immersive technologies, including augmented, virtual and mixed realities."
TIGA,https://tiga.org/,Organization,,,,
Sweden Game Arena,https://swedengamearena.com/en/,Organization,,,Sweden,
Extra Life,https://www.extra-life.org/,Charity,,,,"We are Extra Life, an online grassroots movement working to save local kids through the power of play. From video games to board games, Extra Lifers do what they love to raise money for CMN Hospitals."
Games Done Quick,https://gamesdonequick.com/,Charity,,,,
Able Gamers,https://ablegamers.org/,Charity,,,,
GameChanger Charity,https://gamechangercharity.org/,Charity,,,,"We are changing the game for hospitalized kids. JOIN OUR MISSION Donate Now A special thanks in 2020 to the Dansby Family for their love, support and devotion to helping sick children."
Gamers Outreach,https://gamersoutreach.org/,Charity,,,,We are making a difference in hospitalized children’s lives. Join us or donate to provide video games that help children cope with their treatment & recovery!
Child's Play,https://childsplaycharity.org/,Charity,,,,
St. Jude's Play,https://stjude.tiltify.com/playlive,Charity,,,,
Stack Up,https://www.stackup.org/,Charity,,,,Stack Up is a military charity supporting US and allied active duty and veterans' mental health through the power of gaming and geek culture!
Charity Gaming,https://www.charity-gaming.org/,Charity,,,,Stream to fundraise for charities
JustGiving Gaming,https://gaming.justgiving.com/,Charity,,,,Stream to fundraise for charities
War Child Gaming,https://warchildgaming.org.uk/,Charity,,,,Stream to fundraise for charities
Autistica Play,https://www.autistica.org.uk/,Charity,,,,"Autistica is a charity which funds and campaigns for research to understand the causes of autism, improve diagnosis, and develop evidence-based interventions."